name,address,email,website,phone,postalCode
La Bella Italia Bistrot & Pizzeria,"Chemin du Pra-Novi 4, 1786 Sugiez",bellaitaliasugiez@hotmail.ch,,+41266732100,1786
Restaurant Les 3 Lacs,"Route du Canal 2, 1786 Sugiez",restaurant@camping-les3lacs.ch,http://www.camping-les3lacs.ch/,+41266731212,1786
Hôtel de la Gare,"Route de la Gare 2, 1786 Sugiez",,,+41266732424,1786
Hôtel Restaurant Cave Bel-Air,"Route Principale 145, 1786 Sugiez",,,,1786
Pavy Lounge GmbH,"Route du Pavy 3, 1786 Sugiez",,,+41266730495,1786
Office du Tourisme du Vully,"Route de la Gare 1, 1786 Sugiez",info@levully.ch,http://www.levully.ch/,+41266731872,1786