name,address,email,website,phone,postalCode
Hôtel restaurant le Rivage chez Monmon,"Quai Isaac de Rivaz 4, 1898 St-Gingolph",info@rivage.ch,http://www.rivage.ch/,+41244827030,1898
Bellevue Restaurant Sàrl,"Quai Isaac de Rivaz 1, 1898 St-Gingolph",info@bellevue-restaurant.ch,https://www.bellevue-restaurant.ch/,+41244816272,1898
du Fréney,"Route du Frénay 115, 1898 St-Gingolph",,,+41244818274,1898
Café-Restaurant et Kebab ADA,"Route Cantonale 5, 1898 St-Gingolph",,,+41244812121,1898
Café Helvetia,"Route Cantonale 8, 1898 St-Gingolph",,,+41244818219,1898