name,address,email,website,phone,postalCode
Café-Restaurant et Cave de St-Romain,"Route de Saint-Romain 26, 1966 St-Romain (Ayent)",cavedestromain@netplus.ch,https://www.lesvinsduvalais.ch/encaveur/cave-de-st-romain,+41273981222,1966
Café Travelletti,"Route de Saint-Romain 26, 1966 St-Romain (Ayent)",cavedestromain@netplus.ch,,+41273981222,1966
RDA Restaurants d' Altitude SA,"Route de la Madeleine 75, 1966 Argnou (Ayent)",,,+41273981865,1966
Café Restaurant des Sports,"Route de Botyre 50, 1966 Botyre (Ayent)",,,+41273981643,1966
Cafe paticipatif du Soleil,"Route de Botyre 30, 1966 Botyre (Ayent)",,,+41273981496,1966
Gite de Lourantze,"Dam Zeuzier, 1966 Fortunau (Ayent)",,,+41796867389,1966
Les Rousses,"Route de la Madeleine 75, 1966 Argnoud (Ayent)",,,+41273983597,1966