name,address,email,website,phone,postalCode
Hotel Kurhaus am Sarnersee,"Wilerstrasse 35, 6062 Wilen (Sarnen)",info@kurhaus.info,https://www.kurhaus.info/,+41416667466,6062
Panoramarestaurant des Hotel- Kurhauses am Sarnersee,"Wilerstrasse 35, 6062 Wilen (Sarnen)",,,+41416667466,6062
Taptim Thai,6062 Wilen (Sarnen),,http://www.wilerbad.ch/,+41416627070,6062
Restaurant Boccaccio,"Waldheim, 6062 Wilen",info@waldheim.com,,+41416601383,6062
Panoramarestaurant des Hotel-Kurhauses am Sarnersee,"Wilerstrasse 35, 6062 Wilen",info@kurhaus.info,,+41416667466,6062